feature_group,example_features,source,encoder_available,decoder_required,feedforward_status,allowed_for_inference,allowed_for_training_label,metadata_transmitted,cost_or_caveat
raw_rgb_encoder_input,"frame RGB, grayscale, downsampled RGB, frame timestamp/index",input video frames available to encoder; DAVIS RGB files in current experiments,yes,no,feed-forward for offline video encoding; for online streaming requires declared lookahead window,yes,yes,"only selected keyframe indices/schedule, not RGB features","dataset RGB is the source signal being compressed, not extra side information"
deterministic_rgb_motion_proxy,"frame difference, block SAD/MSE, edge-change, histogram difference, local gradient magnitude",deterministic functions of encoder input RGB frames,yes,no,feed-forward if computed only from input frames inside declared lookahead,yes_primary_cheap_tier,yes,only keyframe schedule,preferred first heuristic selector feature family
pretrained_motion_or_feature_network,"RAFT/GMFlow optical flow, DINO/ResNet frame embeddings, learned motion confidence",fixed pretrained network fed only encoder input RGB frames,yes_if_weights_are_fixed_and_inputs_are_raw_rgb_only,no,feed-forward with compute-cost caveat; no target dense anchors or rendered metrics may enter,yes_optional_higher_compute_tier,yes,only keyframe schedule,network compute and dependency must be documented; no bitrate charge unless features are transmitted
encoder_rd_probe,"candidate Stage158 residual payload bytes, candidate original StreamSplat middle residual estimates",encoder-side candidate encodes/renders using available input and target anchors during compression,yes_but_expensive,no,"offline encoder-side RD probe, not a cheap single-pass feed-forward selector",allowed_as_expensive_encoder_optimization_tier_only_if_schedule_is_transmitted,yes,keyframe schedule plus normal Stage158 payloads,must not be described as low-compute feed-forward; useful upper/teacher policy
rendered_quality_oracle,"rendered PSNR, SSIM, MS-SSIM, LPIPS, bad-case rank",requires target RGB and rendered candidate output,yes_for_offline_evaluation_or_oracle_search,no,not feed-forward selector input for deployable inference,no,yes_offline_label_only,none; labels are not sent,allowed only to create labels/evaluate oracle schedules
target_dense_anchor_or_residual,"target dense anchor, target Gaussian residual, unencoded residual tensor",Stage61 dense anchors or residual against target anchor,yes_for_training_or_stage158_residual_encoding,forbidden,not allowed as selector inference feature except when it is encoded into transmitted Stage158 residual payload,no_for_selector_features,yes_encoder_side_label_or_diagnostic_only,must be actual encoded residual payload if used by decoder,prevents oracle leakage into keyframe selector
